{
  "$schema": "https://json-schema.org/draft/2020-12/schema",
  "$id": "https://raw.githubusercontent.com/bpcakes/jig-skills/main/plugins/jig-privacy-audit/skills/vulnerability-disclosure-and-retest-manager/templates/retest-register.schema.json",
  "title": "Jig Privacy Audit Retest Register",
  "type": "object",
  "required": [
    "schema_version",
    "generated_at",
    "findings"
  ],
  "properties": {
    "schema_version": {
      "const": "1.0"
    },
    "generated_at": {
      "type": "string"
    },
    "scope": {
      "type": "object",
      "additionalProperties": true
    },
    "disclosure": {
      "type": "object",
      "properties": {
        "mode": {
          "enum": [
            "internal_only",
            "coordinated_vendor",
            "public_advisory",
            "customer_notice",
            "none_specified"
          ]
        },
        "contacts": {
          "type": "array",
          "items": {
            "type": "string"
          }
        },
        "timeline": {
          "type": "array",
          "items": {
            "type": "object",
            "required": [
              "date",
              "event"
            ],
            "properties": {
              "date": {
                "type": "string"
              },
              "event": {
                "type": "string"
              },
              "notes": {
                "type": "string"
              }
            },
            "additionalProperties": true
          }
        }
      },
      "additionalProperties": true
    },
    "findings": {
      "type": "array",
      "items": {
        "type": "object",
        "required": [
          "id",
          "title",
          "severity",
          "confidence",
          "status",
          "source_ids",
          "source_skills",
          "affected_claims",
          "evidence",
          "recommended_fix",
          "retest_steps",
          "status_history"
        ],
        "properties": {
          "id": {
            "type": "string",
            "pattern": "^[A-Z0-9-]+-[0-9]{3,}$"
          },
          "title": {
            "type": "string"
          },
          "severity": {
            "enum": [
              "critical",
              "high",
              "medium",
              "low",
              "informational"
            ]
          },
          "confidence": {
            "enum": [
              "high",
              "medium",
              "low"
            ]
          },
          "status": {
            "enum": [
              "open",
              "fixed",
              "partially_fixed",
              "accepted_risk",
              "not_reproducible"
            ]
          },
          "source_ids": {
            "type": "array",
            "items": {
              "type": "string"
            }
          },
          "source_skills": {
            "type": "array",
            "items": {
              "type": "string"
            }
          },
          "surface": {
            "type": "string"
          },
          "affected_claims": {
            "type": "array",
            "items": {
              "type": "string"
            }
          },
          "evidence": {
            "type": "array",
            "items": {
              "type": "object",
              "additionalProperties": true
            }
          },
          "impact": {
            "type": "string"
          },
          "severity_rationale": {
            "type": "string"
          },
          "recommended_fix": {
            "type": "string"
          },
          "retest_steps": {
            "type": "array",
            "items": {
              "type": "string"
            }
          },
          "affected_skills_to_rerun": {
            "type": "array",
            "items": {
              "type": "string"
            }
          },
          "fix_commits": {
            "type": "array",
            "items": {
              "type": "object",
              "required": [
                "commit"
              ],
              "properties": {
                "commit": {
                  "type": "string"
                },
                "url": {
                  "type": "string"
                },
                "notes": {
                  "type": "string"
                }
              },
              "additionalProperties": true
            }
          },
          "retest_evidence": {
            "type": "array",
            "items": {
              "type": "object",
              "additionalProperties": true
            }
          },
          "limitations": {
            "type": "array",
            "items": {
              "type": "string"
            }
          },
          "status_history": {
            "type": "array",
            "items": {
              "type": "object",
              "required": [
                "timestamp",
                "status",
                "note"
              ],
              "properties": {
                "timestamp": {
                  "type": "string"
                },
                "status": {
                  "type": "string"
                },
                "note": {
                  "type": "string"
                }
              },
              "additionalProperties": true
            }
          }
        },
        "additionalProperties": true
      }
    }
  },
  "additionalProperties": true
}
