{
  "schema_version": "1.0",
  "generated_at": "YYYY-MM-DDTHH:MM:SSZ",
  "scope": {
    "product": "",
    "repository": "",
    "tested_versions": [],
    "environments": [],
    "authorization": "",
    "limitations": []
  },
  "disclosure": {
    "mode": "none_specified",
    "contacts": [],
    "timeline": []
  },
  "findings": [
    {
      "id": "VDRM-001",
      "title": "",
      "severity": "medium",
      "confidence": "medium",
      "status": "open",
      "source_ids": [],
      "source_skills": [],
      "surface": "",
      "affected_claims": [],
      "evidence": [],
      "impact": "",
      "severity_rationale": "",
      "recommended_fix": "",
      "retest_steps": [],
      "affected_skills_to_rerun": [],
      "fix_commits": [],
      "retest_evidence": [],
      "limitations": [],
      "status_history": [
        {
          "timestamp": "YYYY-MM-DDTHH:MM:SSZ",
          "status": "open",
          "note": "Imported or opened for remediation tracking."
        }
      ]
    }
  ]
}
